{
  "$schema": "../../schemas/board-profile.schema.json",
  "schema_version": "1.0",
  "board_id": "shelly-plus-1",
  "board_type": "commercial_device",
  "display_name": "Shelly Plus 1",
  "chip": "ESP32-WROOM-32",
  "manufacturer": "Allterco Robotics",
  "wireless": {
    "wifi": [
      "2.4GHz"
    ],
    "wifi_standard": "WiFi 4 (b/g/n)",
    "bluetooth": "BLE 4.2",
    "bluetooth_classic": true,
    "thread": false,
    "zigbee": false,
    "lora": null,
    "ethernet": null
  },
  "power": {
    "usb_type": null,
    "operating_voltage": 3.3,
    "input_voltage_range": "110-240V AC mains",
    "battery_connector": null,
    "charging_ic": null,
    "vbat_monitor_pin": null,
    "deep_sleep_current_ua": 0,
    "light_sleep_current_ma": null,
    "modem_sleep_current_ma": null,
    "solar_input": false,
    "gpio_5v_tolerant": false
  },
  "memory": {
    "flash_mb": 4,
    "psram_mb": 0,
    "psram_type": null,
    "ram_kb": 520
  },
  "gpio": {
    "valid_pins": [
      0,
      4,
      26
    ],
    "strapping_pins": [
      0,
      2,
      5,
      12,
      15
    ],
    "reserved_for_usb": [],
    "reserved_for_flash": [
      6,
      7,
      8,
      9,
      10,
      11
    ],
    "input_only": [],
    "adc1_pins": [
      32,
      33,
      34,
      35,
      36,
      39
    ],
    "adc2_pins": [
      0,
      2,
      4,
      12,
      13,
      14,
      15,
      25,
      26,
      27
    ],
    "touch_pins": [],
    "dac_pins": [],
    "wake_source_pins": [
      0,
      4
    ],
    "i2c_default": {
      "sda": 4,
      "scl": 14
    },
    "spi_default": {
      "mosi": 13,
      "miso": 12,
      "sck": 14,
      "cs": 15
    }
  },
  "onboard_components": {
    "led_gpio": null,
    "led_type": null,
    "boot_button_gpio": 0,
    "reset_button": null,
    "display": null,
    "imu": null,
    "buzzer": null
  },
  "smart_home_capabilities": {
    "bluetooth_proxy": true,
    "voice_assistant": false,
    "matter_controller": false,
    "matter_device": true,
    "zigbee_coordinator": false,
    "thread_border_router": false,
    "ble_tracker": true,
    "camera_support": false,
    "battery_powered": false,
    "ir_blaster": false,
    "rf_proxy_cc1101": false
  },
  "ota_safety": {
    "factory_reset_pin": 0,
    "external_programmer_needed": true,
    "usb_cdc_recovery": false,
    "min_required_features_for_unbricking": [
      "wifi",
      "ota"
    ]
  },
  "form_factor": {
    "antenna": "PCB",
    "ipex_connector": false,
    "dimensions_mm": "45.5 x 33.3 x 16.6",
    "certifications": [
      "CE",
      "FCC",
      "RCM"
    ],
    "operating_temp_c": "-20 to +40"
  },
  "limitations": {
    "max_cpu_mhz": 240,
    "no_dac": false,
    "usb_blocks_gpio": [],
    "psram_blocks_gpio": [],
    "adc2_blocked_when_wifi_active": true,
    "strapping_conflict_warnings": [
      "Shelly Plus 1 is a closed-hardware device. GPIO mapping is fixed: relay GPIO 26, button GPIO 4. Do NOT attempt to repurpose pins.",
      "Flashing custom firmware requires opening the case and connecting a UART programmer."
    ]
  },
  "lifecycle": {
    "status": "active",
    "released": "2021",
    "deprecated_since": null,
    "reason": null,
    "successor": null
  },
  "esphome": {
    "platform": "esp32",
    "variant": "ESP32",
    "framework": "esp-idf",
    "min_version": "2023.4.0",
    "board": null
  },
  "datasheet_url": "https://www.shelly.com/documents/user_guide/shelly_plus_1.pdf",
  "last_verified": "2026-05-13",
  "verified_source": "Shelly hardware documentation",
  "recommended_for": [
    "Single AC mains switch replacement (lights, fans, pumps)",
    "Behind-the-switch smart switch installations",
    "Replacement for non-smart wall switches",
    "Compact form factor inside wall boxes"
  ],
  "not_recommended_for": [
    "Multi-channel control (use Plus 2PM)",
    "Battery projects (mains-only)",
    "Voice assistant satellite (no audio hardware)",
    "GPIO experimentation (pinout is fixed by Shelly hardware)"
  ]
}
